""|"no"|"st"|"en"|"st_flt"|"en_flt"|"dif"|"txt"
"485"|"1"|"00:53:00.079"|"00:53:05.599"|"3180.08"|"3185.6"|"5.52"|"other at all because all the noise really is just bluff"
"486"|"1"|"00:53:08.800"|"00:53:16.000"|"3188.8"|"3196.0"|"7.2"|"since then simon has used all he's learnt to raise awareness of devils"
"487"|"1"|"00:53:16.079"|"00:53:20.000"|"3196.08"|"3200.0"|"3.92"|"i've taken many many people from all"
"488"|"1"|"00:53:18.000"|"00:53:22.159"|"3198.0"|"3202.16"|"4.16"|"around the world out to sea devils and"
"489"|"1"|"00:53:20.000"|"00:53:23.840"|"3200.0"|"3203.84"|"3.84"|"people who have been to all the"
"490"|"1"|"00:53:22.159"|"00:53:26.559"|"3202.16"|"3206.56"|"4.4"|"continents on earth and have seen some"
"491"|"1"|"00:53:23.840"|"00:53:29.280"|"3203.84"|"3209.28"|"5.44"|"of the most amazing wildlife spectacles"
"492"|"1"|"00:53:26.559"|"00:53:30.239"|"3206.56"|"3210.24"|"3.68"|"have one and all said to me this is as"
"493"|"1"|"00:53:29.280"|"00:53:32.960"|"3209.28"|"3212.96"|"3.68"|"good"
"494"|"1"|"00:53:30.239"|"00:53:35.360"|"3210.24"|"3215.36"|"5.12"|"as anything you i've seen on the planet"
"495"|"1"|"00:53:32.960"|"00:53:38.320"|"3212.96"|"3218.32"|"5.36"|"changing public perception has been an"
"496"|"1"|"00:53:35.360"|"00:53:41.119"|"3215.36"|"3221.12"|"5.76"|"important step in devil conservation"
"497"|"1"|"00:53:38.320"|"00:53:43.840"|"3218.32"|"3223.84"|"5.52"|"indeed right here in tasmania there's a"
"498"|"1"|"00:53:41.119"|"00:53:46.000"|"3221.12"|"3226.0"|"4.88"|"stark example of where persecution can"
"499"|"1"|"00:53:43.840"|"00:53:48.320"|"3223.84"|"3228.32"|"4.48"|"lead"
"500"|"1"|"00:53:46.000"|"00:53:50.320"|"3226.0"|"3230.32"|"4.32"|"only a relatively short time ago it"
"501"|"1"|"00:53:48.320"|"00:53:52.960"|"3228.32"|"3232.96"|"4.64"|"drove another top carnivore to extinction"
"502"|"1"|"00:53:53.039"|"00:53:57.119"|"3233.04"|"3237.12"|"4.08"|"a predatory marsupial called the"
"503"|"1"|"00:53:54.960"|"00:53:58.800"|"3234.96"|"3238.8"|"3.84"|"thylacine once lived here"
"504"|"1"|"00:53:58.800"|"00:54:03.360"|"3238.8"|"3243.36"|"4.56"|"this was the last known captive individual"
"505"|"1"|"00:54:03.920"|"00:54:08.840"|"3243.92"|"3248.84"|"4.92"|"filmed in hobart zoo this is the only"
"506"|"1"|"00:54:06.320"|"00:54:12.400"|"3246.32"|"3252.4"|"6.08"|"footage of these extinct"
"507"|"1"|"00:54:08.840"|"00:54:14.880"|"3248.84"|"3254.88"|"6.04"|"predators nicknamed the tasmanian tiger"
"508"|"1"|"00:54:12.400"|"00:54:15.519"|"3252.4"|"3255.52"|"3.12"|"this island was the thylacine's final"
"509"|"1"|"00:54:14.880"|"00:54:18.920"|"3254.88"|"3258.92"|"4.04"|"refuge"
"510"|"1"|"00:54:19.199"|"00:54:24.559"|"3259.2"|"3264.56"|"5.36"|"but when europeans arrived in tasmania"
"511"|"1"|"00:54:22.239"|"00:54:27.199"|"3262.24"|"3267.2"|"4.96"|"they saw the thylacine as a threat to livestock"
"512"|"1"|"00:54:27.840"|"00:54:31.760"|"3267.84"|"3271.76"|"3.92"|"it was soon hunted to extinction"
"513"|"1"|"00:54:32.880"|"00:54:38.480"|"3272.88"|"3278.48"|"5.6"|"this individual died in 1936"
"514"|"1"|"00:54:38.480"|"00:54:45.119"|"3278.48"|"3285.12"|"6.64"|"it's an important reminder of what's at stake for tasmania's wild devils"
"515"|"1"|"00:54:45.440"|"00:54:50.400"|"3285.44"|"3290.4"|"4.96"|"today however despite a shift in public"
"516"|"1"|"00:54:48.000"|"00:54:52.639"|"3288.0"|"3292.64"|"4.64"|"perception of these animals the last"
"517"|"1"|"00:54:50.400"|"00:54:57.119"|"3290.4"|"3297.12"|"6.72"|"decades have seen the emergence of an"
"518"|"1"|"00:54:52.639"|"00:54:59.599"|"3292.64"|"3299.6"|"6.96"|"even greater threat to devil populations"
"519"|"1"|"00:54:57.119"|"00:55:01.599"|"3297.12"|"3301.6"|"4.48"|"in recent times the tasmanian devil has"
"520"|"1"|"00:54:59.599"|"00:55:03.519"|"3299.6"|"3303.52"|"3.92"|"been put on the endangered species lifts"
"521"|"1"|"00:55:01.599"|"00:55:06.400"|"3301.6"|"3306.4"|"4.8"|"because"
"522"|"1"|"00:55:03.519"|"00:55:09.280"|"3303.52"|"3309.28"|"5.76"|"of the facial tumor disease"
"523"|"1"|"00:55:06.400"|"00:55:12.559"|"3306.4"|"3312.56"|"6.16"|"facial tumor disease is a transmissible"
"524"|"1"|"00:55:09.280"|"00:55:16.000"|"3309.28"|"3316.0"|"6.72"|"disease that causes cancerous growths"
"525"|"1"|"00:55:12.559"|"00:55:17.519"|"3312.56"|"3317.52"|"4.96"|"it's devastated devil populations"
"526"|"1"|"00:55:16.000"|"00:55:19.360"|"3316.0"|"3319.36"|"3.36"|"the horrible thing about it is there's"
"527"|"1"|"00:55:17.519"|"00:55:22.320"|"3317.52"|"3322.32"|"4.8"|"no there's no cure"
"528"|"1"|"00:55:19.360"|"00:55:23.679"|"3319.36"|"3323.68"|"4.32"|"so when an animal becomes infected it"
"529"|"1"|"00:55:22.320"|"00:55:25.360"|"3322.32"|"3325.36"|"3.04"|"will die"
"530"|"1"|"00:55:23.679"|"00:55:26.800"|"3323.68"|"3326.8"|"3.12"|"in places where the disease has gone"
"531"|"1"|"00:55:25.360"|"00:55:28.719"|"3325.36"|"3328.72"|"3.36"|"through the landscape"
"532"|"1"|"00:55:26.800"|"00:55:32.039"|"3326.8"|"3332.04"|"5.24"|"the numbers have been reduced by 80 and 90 percent"
"533"|"1"|"00:55:38.400"|"00:55:41.039"|"3338.4"|"3341.04"|"2.64"|"where there are low numbers on the"
"534"|"1"|"00:55:39.760"|"00:55:42.719"|"3339.76"|"3342.72"|"2.96"|"landscape"
"535"|"1"|"00:55:41.039"|"00:55:46.119"|"3341.04"|"3346.12"|"5.08"|"it's not possible to sit in much wild levels anymore"
"536"|"1"|"00:55:48.000"|"00:55:52.400"|"3348.0"|"3352.4"|"4.4"|"that's really really a sad thing and"
"537"|"1"|"00:55:50.559"|"00:55:54.800"|"3350.56"|"3354.8"|"4.24"|"each time now i i"
"538"|"1"|"00:55:52.400"|"00:55:56.639"|"3352.4"|"3356.64"|"4.24"|"when i pack up to leave"
"539"|"1"|"00:55:54.800"|"00:55:58.400"|"3354.8"|"3358.4"|"3.6"|"a devil viewing wild devil viewing"
"540"|"1"|"00:55:56.639"|"00:56:01.119"|"3356.64"|"3361.12"|"4.48"|"session i think well this this could"
"541"|"1"|"00:55:58.400"|"00:56:03.840"|"3358.4"|"3363.84"|"5.44"|"easily be the last time and uh"
"542"|"1"|"00:56:21.760"|"00:56:26.639"|"3381.76"|"3386.64"|"4.88"|"but there is hope"
"543"|"1"|"00:56:23.840"|"00:56:29.039"|"3383.84"|"3389.04"|"5.2"|"a vaccine has been created and some"
"544"|"1"|"00:56:26.639"|"00:56:31.760"|"3386.64"|"3391.76"|"5.12"|"devils seem to be evolving resistance to"
"545"|"1"|"00:56:29.039"|"00:56:33.679"|"3389.04"|"3393.68"|"4.64"|"the disease"
"546"|"1"|"00:56:31.760"|"00:56:35.599"|"3391.76"|"3395.6"|"3.84"|"it is heartening though that this"
"547"|"1"|"00:56:33.679"|"00:56:38.800"|"3393.68"|"3398.8"|"5.12"|"disease having started at this spot 20"
"548"|"1"|"00:56:35.599"|"00:56:40.559"|"3395.6"|"3400.56"|"4.96"|"years ago there are still animals there"
"549"|"1"|"00:56:38.800"|"00:56:41.920"|"3398.8"|"3401.92"|"3.12"|"it gives you an indication of how tough"
"550"|"1"|"00:56:40.559"|"00:56:45.639"|"3400.56"|"3405.64"|"5.08"|"these little creatures are and how they will hang on in the landscape"
"551"|"1"|"00:56:46.719"|"00:56:52.400"|"3406.72"|"3412.4"|"5.68"|"as a safeguard simon also breeds devils"
"552"|"1"|"00:56:50.239"|"00:56:56.760"|"3410.24"|"3416.76"|"6.52"|"as part of a wider human effort to protect the species from extinction"
"553"|"1"|"00:57:02.559"|"00:57:08.239"|"3422.56"|"3428.24"|"5.68"|"tasmanian devils are only found in"
"554"|"1"|"00:57:05.280"|"00:57:11.199"|"3425.28"|"3431.2"|"5.92"|"tasmania they became extinct on mainland"
"555"|"1"|"00:57:08.239"|"00:57:12.960"|"3428.24"|"3432.96"|"4.72"|"australia a long time ago"
"556"|"1"|"00:57:11.199"|"00:57:14.800"|"3431.2"|"3434.8"|"3.6"|"one of the worst things that could ever"
"557"|"1"|"00:57:12.960"|"00:57:18.480"|"3432.96"|"3438.48"|"5.52"|"happen i guess is the tasmanian devil ends up like the tasmanian tiger"
"558"|"1"|"00:57:18.880"|"00:57:22.239"|"3438.88"|"3442.24"|"3.36"|"it's so vital that these animals are"
"559"|"1"|"00:57:20.960"|"00:57:23.679"|"3440.96"|"3443.68"|"2.72"|"protected"
"560"|"1"|"00:57:22.239"|"00:57:24.639"|"3442.24"|"3444.64"|"2.4"|"let's hope for the future that the"
"561"|"1"|"00:57:23.679"|"00:57:26.719"|"3443.68"|"3446.72"|"3.04"|"devils"
"562"|"1"|"00:57:24.639"|"00:57:28.000"|"3444.64"|"3448.0"|"3.36"|"with the help from us"
"563"|"1"|"00:57:26.719"|"00:57:31.360"|"3446.72"|"3451.36"|"4.64"|"can"
"564"|"1"|"00:57:28.000"|"00:57:34.239"|"3448.0"|"3454.24"|"6.24"|"once again be free in the wild and beat this disease"
"565"|"1"|"00:57:35.280"|"00:57:41.119"|"3455.28"|"3461.12"|"5.84"|"tasmania is a refuge to some unusual"
"566"|"1"|"00:57:38.400"|"00:57:43.760"|"3458.4"|"3463.76"|"5.36"|"species many of which are long extinct"
"567"|"1"|"00:57:41.119"|"00:57:47.199"|"3461.12"|"3467.2"|"6.08"|"on the australian mainland"
"568"|"1"|"00:57:43.760"|"00:57:49.519"|"3463.76"|"3469.52"|"5.76"|"this island may be a vast wilderness but"
"569"|"1"|"00:57:47.199"|"00:57:51.599"|"3467.2"|"3471.6"|"4.4"|"even here the influence of our human"
"570"|"1"|"00:57:49.519"|"00:57:53.280"|"3469.52"|"3473.28"|"3.76"|"world is felt"
"571"|"1"|"00:57:51.599"|"00:57:54.480"|"3471.6"|"3474.48"|"2.88"|"and a great deal of hard work and"
"572"|"1"|"00:57:53.280"|"00:57:57.360"|"3473.28"|"3477.36"|"4.08"|"dedication"
"573"|"1"|"00:57:54.480"|"00:58:01.159"|"3474.48"|"3481.16"|"6.68"|"is still required to ensure the survival of its wild residents"
"574"|"1"|"00:58:08.159"|"00:58:13.679"|"3488.16"|"3493.68"|"5.52"|"next sunday at nine we are in florida to"
"575"|"1"|"00:58:10.880"|"00:58:15.760"|"3490.88"|"3495.76"|"4.88"|"visit america's animal paradise"
"576"|"1"|"00:58:13.679"|"00:58:18.480"|"3493.68"|"3498.48"|"4.8"|"over on the bbc iplayer there's more"
"577"|"1"|"00:58:15.760"|"00:58:21.360"|"3495.76"|"3501.36"|"5.6"|"exploration as we go under the sea in"
"578"|"1"|"00:58:18.480"|"00:58:23.760"|"3498.48"|"3503.76"|"5.28"|"blue planet live available now next here"
"579"|"1"|"00:58:21.360"|"00:58:26.800"|"3501.36"|"3506.8"|"5.44"|"on bbc2 this evening the misadventures"
"580"|"1"|"00:58:23.760"|"00:58:30.280"|"3503.76"|"3510.28"|"6.52"|"of ramis ranganathan find him in albania on wolf patrol"
